{
  "format": "litodoc-extract",
  "version": 2,
  "request_id": "fixture-record-members-v2",
  "package": {
    "name": "litodoc-fixture",
    "identity": "litodoc-fixture@0.1.0"
  },
  "target": {
    "name": "fixture",
    "kind": "library"
  },
  "unit": {
    "identity": "fixture-record-members",
    "kind": "translation-unit",
    "is_interface": false,
    "source": "tests/fixtures/record-members.cpp",
    "module": null
  },
  "invocation": {
    "cwd": ".",
    "arguments": [
      "/nix/opt/llvm/22/bin/clang++",
      "-std=c++20",
      "tests/fixtures/record-members.cpp"
    ]
  },
  "compiler": {
    "identity": "clang-22.1.8-fixture",
    "target": "x86_64-unknown-linux-gnu"
  },
  "package_root": ".",
  "imported_artifacts": []
}
